{
  "$schema": "https://json-schema.org/draft/2020-12/schema",
  "$id": "https://github.com/ahmed3bead/teach-me/schemas/study-curriculum.schema.json",
  "title": "Teach Me study curriculum",
  "type": "object",
  "required": ["version", "curriculum_id", "session_id", "subject", "language", "target_capability", "scope", "modules", "completion_criteria"],
  "properties": {
    "version": {"const": "1.0.0"},
    "curriculum_id": {"type": "string", "minLength": 1},
    "session_id": {"type": "string", "minLength": 1},
    "subject": {"type": "string", "minLength": 1},
    "language": {"enum": ["ar-MSA", "ar-EG", "en", "mixed"]},
    "target_capability": {"type": "string", "minLength": 1},
    "starting_point": {"type": "string"},
    "scope": {"type": "string", "minLength": 1},
    "source_ids": {"type": "array", "items": {"type": "string"}, "uniqueItems": true},
    "modules": {
      "type": "array",
      "minItems": 1,
      "items": {
        "type": "object",
        "required": ["module_id", "title", "outcome", "lessons"],
        "properties": {
          "module_id": {"type": "string", "minLength": 1},
          "title": {"type": "string", "minLength": 1},
          "outcome": {"type": "string", "minLength": 1},
          "prerequisite_module_ids": {"type": "array", "items": {"type": "string"}, "uniqueItems": true},
          "lessons": {
            "type": "array",
            "minItems": 1,
            "items": {
              "type": "object",
              "required": ["lesson_id", "title", "objective_ids", "demonstrable_outcome", "activity", "assessment", "source_refs"],
              "properties": {
                "lesson_id": {"type": "string", "minLength": 1},
                "title": {"type": "string", "minLength": 1},
                "objective_ids": {"type": "array", "minItems": 1, "items": {"type": "string"}, "uniqueItems": true},
                "demonstrable_outcome": {"type": "string", "minLength": 1},
                "activity": {"type": "string", "minLength": 1},
                "assessment": {"type": "string", "minLength": 1},
                "source_refs": {"type": "array", "items": {"type": "string"}},
                "estimated_minutes": {"type": "integer", "minimum": 1}
              },
              "additionalProperties": false
            }
          }
        },
        "additionalProperties": false
      }
    },
    "completion_criteria": {"type": "array", "minItems": 1, "items": {"type": "string"}},
    "active_module_id": {"type": ["string", "null"]},
    "active_lesson_id": {"type": ["string", "null"]}
  },
  "additionalProperties": false
}
